{
 "reasoning": "One linear-axis CO2 loading panel. The legend heading 'CO2' explicitly binds all six temperature entries to CO2. Each entry uses a distinct filled marker, and only one monotonic adsorption trajectory is visible per temperature. The curves are densely marked at low pressure and more widely spaced at higher pressure; no separate desorption branches are apparent.",
 "x": {
  "title": "P",
  "unit": "mbar",
  "scale": "linear",
  "ticks": [
   0,
   40,
   80,
   120
  ],
  "x_setpoints_visible": [
   1,
   2,
   3,
   4,
   5,
   6,
   8,
   10,
   15,
   20,
   25,
   30,
   33,
   40,
   47,
   53,
   60,
   67,
   73,
   80,
   87,
   93,
   100,
   102,
   107,
   114
  ]
 },
 "y": {
  "title": "CO2 Loading",
  "unit": "mmol/g",
  "scale": "linear",
  "ticks": [
   0,
   0.5,
   1,
   1.5,
   2,
   2.5,
   3
  ]
 },
 "legend_bbox_norm": [
  0.578,
  0.499,
  0.921,
  0.653
 ],
 "legend_position": "lower right inside the plot",
 "series": [
  {
   "label": "CO2 303K",
   "gas": "CO2",
   "species_evidence": "Legend heading 'CO2' binds the legend entry '303K' to CO2.",
   "temperature_k": 303,
   "color_name": "red",
   "color_hex": "#e51c23",
   "marker": "circle",
   "marker_fill": "filled",
   "line_style": "none",
   "has_line": false,
   "quantity_type": "co2_loading",
   "loading_basis": "per gram of adsorbent",
   "extract": true,
   "y_anchors": {
    "p25": 2.2,
    "p50": 2.55,
    "p75": 2.79,
    "p100": 2.96
   },
   "n_markers_estimate": 25
  },
  {
   "label": "CO2 313K",
   "gas": "CO2",
   "species_evidence": "Legend heading 'CO2' binds the legend entry '313K' to CO2.",
   "temperature_k": 313,
   "color_name": "orange",
   "color_hex": "#f4a21b",
   "marker": "square",
   "marker_fill": "filled",
   "line_style": "none",
   "has_line": false,
   "quantity_type": "co2_loading",
   "loading_basis": "per gram of adsorbent",
   "extract": true,
   "y_anchors": {
    "p25": 2.02,
    "p50": 2.36,
    "p75": 2.53,
    "p100": 2.66
   },
   "n_markers_estimate": 25
  },
  {
   "label": "CO2 323K",
   "gas": "CO2",
   "species_evidence": "Legend heading 'CO2' binds the legend entry '323K' to CO2.",
   "temperature_k": 323,
   "color_name": "green",
   "color_hex": "#198b43",
   "marker": "triangle_up",
   "marker_fill": "filled",
   "line_style": "none",
   "has_line": false,
   "quantity_type": "co2_loading",
   "loading_basis": "per gram of adsorbent",
   "extract": true,
   "y_anchors": {
    "p25": 1.79,
    "p50": 2.13,
    "p75": 2.3,
    "p100": 2.42
   },
   "n_markers_estimate": 25
  },
  {
   "label": "CO2 333K",
   "gas": "CO2",
   "species_evidence": "Legend heading 'CO2' binds the legend entry '333K' to CO2.",
   "temperature_k": 333,
   "color_name": "blue",
   "color_hex": "#29469d",
   "marker": "hexagon",
   "marker_fill": "filled",
   "line_style": "none",
   "has_line": false,
   "quantity_type": "co2_loading",
   "loading_basis": "per gram of adsorbent",
   "extract": true,
   "y_anchors": {
    "p25": 1.58,
    "p50": 1.98,
    "p75": 2.15,
    "p100": 2.24
   },
   "n_markers_estimate": 25
  },
  {
   "label": "CO2 353K",
   "gas": "CO2",
   "species_evidence": "Legend heading 'CO2' binds the legend entry '353K' to CO2.",
   "temperature_k": 353,
   "color_name": "magenta",
   "color_hex": "#c52a86",
   "marker": "diamond",
   "marker_fill": "filled",
   "line_style": "none",
   "has_line": false,
   "quantity_type": "co2_loading",
   "loading_basis": "per gram of adsorbent",
   "extract": true,
   "y_anchors": {
    "p25": 1.08,
    "p50": 1.59,
    "p75": 1.8,
    "p100": 1.93
   },
   "n_markers_estimate": 25
  },
  {
   "label": "CO2 373K",
   "gas": "CO2",
   "species_evidence": "Legend heading 'CO2' binds the legend entry '373K' to CO2.",
   "temperature_k": 373,
   "color_name": "black",
   "color_hex": "#000000",
   "marker": "plus",
   "marker_fill": "filled",
   "line_style": "none",
   "has_line": false,
   "quantity_type": "co2_loading",
   "loading_basis": "per gram of adsorbent",
   "extract": true,
   "y_anchors": {
    "p25": 0.62,
    "p50": 1.1,
    "p75": 1.39,
    "p100": 1.56
   },
   "n_markers_estimate": 25
  }
 ],
 "branches": "adsorption_only",
 "notes": "No inset, broken axis, dual y-axis, or error bars. All markers are filled. The x-axis title is printed above the upper-right side of the frame, and ticks are also drawn on the top and right sides. Apparent thick traces below roughly 30 mbar result from densely overlapping markers rather than clearly distinguishable line segments."
}