{
  "reasoning": "One axis frame. Legend top-left lists three series; filled circles and squares are CO2, open triangles are N2.",
  "x": {
    "title": "Pressure",
    "unit": "kPa",
    "scale": "linear",
    "ticks": [
      0,
      20,
      40,
      60,
      80,
      100
    ],
    "x_setpoints_visible": [
      1,
      5,
      10,
      20,
      40,
      60,
      80,
      100
    ]
  },
  "y": {
    "title": "CO2 uptake",
    "unit": "mmol/g",
    "scale": "linear",
    "ticks": [
      0,
      1,
      2,
      3,
      4
    ]
  },
  "legend_bbox_norm": [
    0.14,
    0.08,
    0.42,
    0.3
  ],
  "legend_position": "upper left inside the plot",
  "series": [
    {
      "label": "CO2 273 K",
      "gas": "CO2",
      "species_evidence": "Legend entry 'CO2 273 K'; caption: CO2 (filled)",
      "temperature_k": 273,
      "color_name": "blue",
      "color_hex": "#1f4e9c",
      "marker": "circle",
      "marker_fill": "filled",
      "line_style": "solid",
      "has_line": true,
      "quantity_type": "co2_uptake",
      "loading_basis": "per gram of sorbent",
      "extract": true,
      "y_anchors": {
        "p25": 2.1,
        "p50": 2.9,
        "p75": 3.4,
        "p100": 3.7
      },
      "n_markers_estimate": 12
    },
    {
      "label": "CO2 298 K",
      "gas": "CO2",
      "species_evidence": "Legend entry 'CO2 298 K'; caption: CO2 (filled)",
      "temperature_k": 298,
      "color_name": "red",
      "color_hex": "#c0392b",
      "marker": "square",
      "marker_fill": "filled",
      "line_style": "solid",
      "has_line": true,
      "quantity_type": "co2_uptake",
      "loading_basis": "per gram of sorbent",
      "extract": true,
      "y_anchors": {
        "p25": 1.2,
        "p50": 1.8,
        "p75": 2.2,
        "p100": 2.5
      },
      "n_markers_estimate": 12
    },
    {
      "label": "N2 298 K",
      "gas": "N2",
      "species_evidence": "Legend entry 'N2 298 K'; caption: N2 (open)",
      "temperature_k": 298,
      "color_name": "grey",
      "color_hex": "#7f7f7f",
      "marker": "triangle_up",
      "marker_fill": "open",
      "line_style": "none",
      "has_line": false,
      "quantity_type": "n2_uptake",
      "loading_basis": "per gram of sorbent",
      "extract": false,
      "y_anchors": {
        "p25": 0.05,
        "p50": 0.1,
        "p75": 0.14,
        "p100": 0.18
      },
      "n_markers_estimate": 10
    }
  ],
  "branches": "adsorption_only",
  "notes": "No inset, single y axis, no error bars."
}
